vol_requests,summary,category_desc,Postcode,Latitude,Longitude
25,"Help support the Lexington School and Center for the Deaf in running our very first craft fair!  We've advertised everywhere and are hoping for a huge turnout.  Help out with set-up, selling raffles, greeting attendees, assisting vendors, and breaking-down.  We'd love to have you help!  ASL welcome!",Strengthening Communities,11370.0,40.761762,-73.893139
1,The Chelsea Art Museum would like to get a volunteer assistant to work with an artist.,Strengthening Communities,10011.0,40.740887,-73.9995464
1,To design outdoor signs and promotional flyers.,Strengthening Communities,11226.0,40.6460705,-73.9551509
50,Show your support for Van Cortlandt Park by participating in a Hike with the Friends of Van Cortlandt Park,Strengthening Communities,10463.0,40.884999,-73.892977
8,Garden with children and supervise activities on Saturdays.,Strengthening Communities,11415.0,40.7068045,-73.8315833
100,The U.S. Fund for UNICEF is inviting committed volunteers to promote the campaign in their communities in inspiring ways and to host UNICEF Tap Project fundraising events.,Environment,10038.0,40.706397,-74.006341
30,"On August 20th, 2011, join NYC Parks and the Cooper-Hewitt National Design Museum for the third annual FlyNY Kite Festival!",Strengthening Communities,10065.0,40.7660142,-73.9646852
50,"Thousands of New Yorkers aren’t able to dig out the snow; many need help shoveling snow, bringing groceries into their home, or traveling to mass transit hubs.  If you’re an able-bodied New Yorker with a few minutes to spare, please find an opportunity in your neighborhood below.",Helping Neighbors in Need,10007.0,40.713265,-74.007063
99,A public relations plan outlines an organization's objectives and creates a road map for conducting external communications. An organization will develop key messages to the public to influence opinions and actions.,Strengthening Communities,10013.0,40.720942,-73.997929
8,"The Tank is currently looking for Fall 2011 in the following categories: development, marketing, volunteer coordinator and artistic liaison.",Strengthening Communities,10036.0,40.7594193,-73.9892203
1,"Thank you for contacting New York Cares about our Children’s Recreation projects. Sports and fitness projects keep children healthy and active, arts and culture projects help them discover their creativity, and recreational outings expose them to the unique activities and culture of New York City.",Health,10001.0,40.7484356,-73.9940338
50,Volunteer to help NYC's youngest learners!,Strengthening Communities,10007.0,40.713265,-74.007063
500,"Summer Streets Needs Volunteers!   Be an invaluable part of Summer Streets, NYC’s best summer event!",Strengthening Communities,10007.0,40.7141085,-74.0083369
99,"An accounting or bookkeeping system is the foundation for a nonprofit’s success and effectiveness. This project requires that the organization has a minimally functional system, and the accounting professional will help improve or enhance it by offering advice and custom reports.",Strengthening Communities,10013.0,40.720942,-73.997929
99,"The art of copywriting involves the strategic articulation of words to powerfully communicate a message to target audiences about an organization or specific topics such as an organization’s mission, programs, services or projects.",Strengthening Communities,10013.0,40.720942,-73.997929
20,"Cheer on the hundreds of athletes with developmental disabilities who will be participating in the SUS Olympics on May 20th at Riverbank State Park.   Services for the UnderServed (SUS) needs assistance with running the event, including being timers, measuring throws, and awarding medals.",Helping Neighbors in Need,10001.0,40.746817,-73.993655
20,"Tackle cancer, global warming, and pollution all in one on Sunday, September 18 from 8 am-12 pm at the 21st annual Komen NYC Race for the Cure in Central Park at the Naumberg Bandshell on the 72nd St Transverse.",Strengthening Communities,10007.0,40.713797,-74.005494
10,Heart Gallery NYC needs volunteers to help out at our information table in Brooklyn. Our information table is set up at the exhibit at Atlantic Terminal.  Our goal is to raise awareness about children in need of loving families as well as to recruit prospective foster and adoptive parents!,Strengthening Communities,11217.0,40.6822886,-73.9790429
99,"A fundraising plan defines an organization’s fundraising goals, outlines prospective funding sources and includes the specific strategy and tactics to achieve the organization’s fundraising goals.",Strengthening Communities,10013.0,40.720942,-73.997929
99,"Sustaining donors’ engagement with an organization is far more cost-effective than acquiring new donors. A donor relations strategy involves an effective structure for engaging existing donors in the organization’s work by timely and appropriate donor communication, and gift stewardship.",Strengthening Communities,10013.0,40.720942,-73.997929
1,"Position entails completing mental health claim forms monthly, tracking payments and interfacing with insurance companies regarding payments, etc.",Helping Neighbors in Need,10001.0,40.7484356,-73.9940338
100,"Brighten the day of a senior!   Deliver a Passover package and visit with an older person for about an hour.   Sunday, April 10, 2011  10:00 - 12:00   REGISTER ONLINE:  www.dorotusa.org",Helping Neighbors in Need,10024.0,40.78623,-73.9756746
2,English teacher needed to teach English as a Second Language.,Helping Neighbors in Need,10013.0,40.714459,-73.999347
100,"We need voulnteers to help paint our afterschool program from 9am to 4pm starting April 13, 2011 to May 13, 2011. This project would be useful for someone who needs community services.",Strengthening Communities,10027.0,40.8104656,-73.9505422
5,Financial literacy for adults,Helping Neighbors in Need,10013.0,40.72631,-74.00749
3,Provide childcare to groups of young children while their parents are in workshops and manage volunteer chilcare helpers,Strengthening Communities,10025.0,40.7978043,-73.9675844
100,"Friendly Visiting is a fantastic program that pairs wonderful and dedicated people like you to visit the home-bound elderly in your area.  Visits take place once a week, based on your schedule and last for one hour.  With our busy schedules, what rewarding opportunity could be better than that?",Helping Neighbors in Need,11224.0,40.5798314,-73.9987552
1,"Duties include entering donations and pledges into database, creating thank you letters, updating donor information, updating reports, reconciling bank statements, and assisting the event coordinator.",Strengthening Communities,10007.0,40.713001,-74.004181
25,Help clean up tree limbs and debris that came down during Hurricane Irene.,Emergency Preparedness,10007.0,40.713265,-74.007063
15,Are you interested in working with youth to help them develop real life skills that will help better their lives and become excited about school. Then come be a B.A.C. Mentor.  We are looking for volunteers who can teach academic/career skills or life skills to high school students.,Education,11432.0,40.70848,-73.800065
50,"Take part in city wide Pride events, marches and rallies! Volunteers are needed to represent Queens Pride House at events all through the month of June. Sign up for a training today!",Strengthening Communities,11372.0,40.749193,-73.889702
30,"Help water and care for the 70,000 new street trees that have been planted across New York City! Join the MillionTreesNYC Stewardship Corps and help keep New York City GREEN by coming to a free MillionTreesNYC stewardship workshop",Environment,11355.0,40.7504407,-73.8199665
15,A walk in Riverside Park on Sun. June 5th to raise funds for the NYCHC  and the National Hemophilia Foundation. The New York City Hemophilia Walk was the first and is still the largest of the Hemophilia Walks held by NHF across the country. Together these walks represent NHF’s largest events.,Strengthening Communities,10001.0,40.748715,-73.984806
3,"SMART Recovery NYC has a solid program for those suffering from addictive behavior problems. We use a range of cognitive-behavioral techniques to manage urges, modulate emotions and problem solve.",Education,10021.0,40.7701875,-73.9596759
1,"The New York Legal Assistance (NYLAG), a non-profit law firm based in New York City, is recruiting volunteers for its Consumer Protection Law Project.",Helping Neighbors in Need,10004.0,40.70447,-74.009406
2,A bi-weekly nutrition workshop for low-income seniors who reside in Brooklyn. The goal of these workshops is to focus on different aspects of nutrition each time and give seniors useful and practical information about how they can improve their daily diets.,Helping Neighbors in Need,11224.0,40.5798314,-73.9987552
1,NYAWC is seeking a volunteer to assist our busy development department and staff our administrative office’s welcome desk.,Strengthening Communities,10004.0,40.706045,-74.013096
1,BCA is searching for an intern for its administrative office in New York City. Please see the full description for further details.,Strengthening Communities,10016.0,40.750131,-73.981247
15,Do you Love Working with Books? Help a Brooklyn elementary school sort and organize their books.,Strengthening Communities,10010.0,40.739861,-73.9851916
2,"Scheduling, updating, organizing website for New York Futsal's camps, leagues, clinics and after school programs. Someone who is creative and likes making websites functional while looking great, while receiving the title as Website Coordinator/ Manager. Also, person can work mostly from home!",Strengthening Communities,10024.0,40.78623,-73.9756746
20,"Date: Sunday,  June 5, 2011: Manhattan – Battery Park",Strengthening Communities,10006.0,40.706251,-74.012952
90,TBL is now seeking volunteers to apply for the Fall 2011-Spring 2012 academic year.,Education,10017.0,40.752685,-73.9734419
20,"PAL IS 218 Beacon 1st Annual Community Health & Education Fair.  The fair will be held Saturday, June 25, 2011 from 11 AM to 3 PM. The fair will include health and career information, community performers, local entrepreneurs, and children’s entertainment. We have multiple volunteer opportunities!",Health,10003.0,40.7313422,-73.9887282
2,"NYC Parks and Recreation seeks your participation to enrich our recreation facilities! Shape Up New York is a free fitness program for all ages and is looking for additional instructors at the Jackie Robinson Recreation Center (89 Bradhurst Ave., NY, NY 10031), accessible by A, B, C, D trains.",Health,10029.0,40.7920271,-73.9445046
99,"A one-pager communicates concise overview information about an organization, its mission, and/or the programs it runs. This brief document provides key messaging about an organization, its specific initiatives, and its strategic direction to target audiences, stakeholders, or the media",Strengthening Communities,10013.0,40.720942,-73.997929
20,Recycling in the city has declined and we need YOU to help get NYC recycling again!,Environment,11231.0,40.6802278,-74.0004106
4,The International Youth Leadership Institute supports active community leadership and global understanding through Seminars and Travel Programs in Africa and Latin America,Education,10014.0,40.733935,-74.0049302
10,"Change a community!  Give the gift of self confidence, independence, health, and a smaller carbon footprint! Volunteer for Bike New York!",Health,10115.0,40.811101,-73.964168
6,HEAF seeks mentors for our NYCService-funded Middle School Mentoring Initiative. Mentors will be placed with small groups of students at Renaissance Military Leadership Academy in Harlem in order to positively impact the students’ academic and emotional development in pursuit of college education.,Education,10027.0,40.8104656,-73.9505422
100,"Work one-on-one with a First-Generation College Student to develop a life plan and provide general career guidance.  Support, guide and advise students throughout their Fellowship.",Education,10013.0,40.717363,-74.006897
2,"Lifebeat, a non-profit dedicated to HIV/AIDS prevention through music seeks TWO (2) dedicated interns with lots of energy to assist us this winter 2011 through summer 2011.",Strengthening Communities,10036.0,40.757636,-73.985804
1,This is a good opportunity for someone who either has non-profit experience or who would like to learn the workings of a non-profit organization up close.,Strengthening Communities,10007.0,40.713001,-74.004181
1,This volunteer opportunity allows you to work in a garden zone of your choice within Hudson River Park.  You’ll be working with a Lead Gardener on a regular basis to help maintain a specific area.,Strengthening Communities,10014.0,40.733935,-74.0049302
2,"We are New York City’s largest girls-only youth and leadership development program where girls learn to lead with courage, confidence and character to make their communities and the world  a better place.",Strengthening Communities,11205.0,40.690765,-73.971376
15,Volunteer at the annual Special Camp Fair helping families of children with disabilities find summer programs.,Strengthening Communities,10003.0,40.7313422,-73.9887282
250,Help clean up tree limbs that came down during Hurricane Irene.,Emergency Preparedness,11693.0,40.5992482,-73.8180932
5,"Blue Engine recruits, selects, trains, and supports recent college graduates who dedicate one year of service to accelerate academic achievement in high-need public high schools. Since we are still in the early stages of growth, we need driven people to help us get the word out about Blue Engine.",Education,11201.0,40.6927173,-73.9916465
2,Girls Write Now is accepting applications for volunteer or for-credit interns for Fall 2011. Interns will gain valuable experience with a fast-growing nationally recognized non-profit organization and also enhance his/her career opportunities in the literary and arts education professions.,Education,10018.0,40.754116,-73.9903452
10,Recruiting outstanding volunteers to collaborate on the boldest nonprofit initiative we know. We are looking for passionate volunteers with exceptional skills to take initiative on different projects. This is an outstanding leadership opportunity in an innovative start-up nonprofit organization,Education,10001.0,40.749794,-73.991486
30,Are you 18 years of age or older?  We have opportunities during the day from 9-3 and in the evening  from  4-10. (There can be some flexibility during the evening shift for those who leave work at 5).   Contact us to schedule your interview today!,Helping Neighbors in Need,10035.0,40.7946297,-73.9416057
50,"New York’s College Goal Sunday is a service project of the New York State Financial Aid Administrators Association and the New York State Higher Education Services Corp., the state financial aid agency.",Education,10461.0,40.8458471,-73.8411421
200,"The American Diabetes Association's largest Latino event of the year – Feria de Salud, scheduled to take place on Saturday, August 27, 2011.",Health,10001.0,40.747629,-73.99306
150,"Through our renowned Partnership Program, PENCIL builds and supports customized relationships between business leaders and principals to inspire innovation and transform public schools.",Education,10010.0,40.739861,-73.9851916
1000,Help Cancer Patients with their treatement needs by donating blood or platelets.,Emergency Preparedness,10065.0,40.764817,-73.958168
17,Work with a team to do fundraising,Strengthening Communities,11426.0,40.7340142,-73.7214195
1,"Warm up the day of a senior!   Deliver a package and visit with an older person for about an hour.    Sunday, Jan. 30, 2010   10:00 am - Noon   DOROT 171 West 85 Street (off Amsterdam Ave.)    Photo ID Required",Helping Neighbors in Need,10024.0,40.78623,-73.9756746
2,"HRC seeks enthusiastic and committed volunteers to work with us in our training, overdose, and policy programs. Volunteer duties may include:",Strengthening Communities,10001.0,40.7484356,-73.9940338
10,Assist with office work and interact with staff and clients at Brooklyn Home Delivered Meals office.,Helping Neighbors in Need,10001.0,40.7484356,-73.9940338
2,Mainchance Drop-In Center for Manhattan's homeless and hungry is seeking a volunteer yoga instructor to continue work with interested clients.,Health,10016.0,40.7454894,-73.9797093
1,The Mayor's Office of Immigrant Affairs is seeking an experienced graphic designer to donate their time and skill to make the NYC Restaurant Owner Manual come to life.,Strengthening Communities,10007.0,40.7141085,-74.0083369
200,"Governor’s Island needs volunteers for programs for  its on-Island partners,such as serving as an Island Ambassador, staffing large public events, maintaining flower beds in the Historic District, or working with children at the Island's Harbor Discovery Area. Sign up at: Bit.ly/GIAVolunteer !",Strengthening Communities,10003.0,40.734163,-73.988627
2,Build a website for an Afghan business,Strengthening Communities,10010.0,40.739861,-73.9851916
99,"Event planning helps an organization coordinate all the moving pieces of a major event, including venue & logistics, invitation, evening program & entertainment, caterers, sponsors, ticketing, and gift bags/auctions/raffles.",Strengthening Communities,10013.0,40.720942,-73.997929
15,"Become a volunteer with Bike New York, a non-profit Bicycling organization, and give someone the life changing skill of knowing how to ride a bike!",Education,10115.0,40.811101,-73.964168
2,"NYC Parks and Recreation seeks your participation to enrich our recreation facilities! Shape Up New York is a free fitness program for all ages and is looking for additional instructors at the Asser Levy Recreation Center (392 Asser Levy Place NY, NY, 10010), accessible by the M23 bus and 6 train.",Health,10029.0,40.7920271,-73.9445046
100,Join us as we start our fall volunteer season with events in three areas of Van Cortlandt Park,Strengthening Communities,10463.0,40.895865,-73.892294
40,"Monday, April 11, 2011: Our Time seeks volunteers to help with preparations for and coordination of its 9th Annual Benefit Gala, which will be honoring David Seidler, writer of The King's Speech.",Strengthening Communities,10003.0,40.729409,-73.997817
1,"NY Artists Unlimited is a 28 year old nonprofit organization that takes free professional theatre and art to under-served audiences. A multicultural company, we tour New York City and the Northeast with works that evoke dignity of the individual and sanctity of the human spirit.",Strengthening Communities,10011.0,40.740887,-73.9995464
10,"Volunteers needed for event setup, greeting guests, and run of show for the Battery Gala on June 7th. Dinner will be provided.",Strengthening Communities,10004.0,40.702593,-74.011671
99,"A Search Engine Optimization (SEO) plan helps an organization's website to rank better organically across various search engines, including Google, Yahoo and Bing. Organic ranking is determined by a variety of factors that include both on the page and off the page elements.",Strengthening Communities,10013.0,40.720942,-73.997929
2,The Jewish Museum seeks a volunteer staff development trainer.,Strengthening Communities,10128.0,40.785298,-73.957263
1,"NYC Parks and Recreation seeks your participation to enrich our recreation facilities! Shape Up New York is a free fitness program for all ages and is looking for additional instructors at St. Mary’s Recreation Center (St. Ann’s Avenue at East 145th street, Bronx, NY 10455)",Health,10455.0,40.811972,-73.914275
3,Lead a poetry class with our seniors.,Strengthening Communities,10001.0,40.7484356,-73.9940338
100,"he Board of Elections in the City of New York is in need of poll workers to serve at poll sites across the city. The Board is also recruiting bilingual residents fluent in Spanish, Chinese or Korean to serve as  interpreters on Election Day.",Strengthening Communities,10007.0,40.7141085,-74.0083369
3,"Lenox Hill Neighborhood House, widely recognized as one of New York's premier human services providers, is a 117-year old settlement house that provides an extensive array of effective and integrated services--social, educational, legal, health, housing, mental health, nutritional and fitness.",Helping Neighbors in Need,10001.0,40.7484356,-73.9940338
10,Want a meaningful volunteer experience? Come and work one on one with Met Council clients to update their resumes.,Helping Neighbors in Need,10038.0,40.707116,-74.007329
2,Volunteers are needed to help the residents and staff of JASA Cooper Square Senior Housing Building with their flea markets.,Helping Neighbors in Need,10001.0,40.7484356,-73.9940338
1,Provide legal services and advice to the agency and ensure our compliance to all applicable NYS non-profit laws and provisions in our day to day functioning.,Strengthening Communities,11213.0,40.674103,-73.929644
99,"A well-designed proposal budget accompanies an organization’s grant proposal or major ask and may be required by a funder. It amplifies the proposal by providing a well thought-out, specific, and tangible plan for the use of funds.",Strengthening Communities,10013.0,40.720942,-73.997929
25,"Seeking volunteers at various environmental recreation stations and as mobile museum docents for upcoming Maritime Festival and Pirates Fest at IKEA ERIE BASIN. Volunteers will be outfitted in Pirate Costume, or can bring their own-event is on JULY 30th",Environment,11231.0,40.6802278,-74.0004106
20,"Major Objective: To provide a stable, caring and loving environment for BAW’s animals while they are on medical or behavior treatment; to increase social interaction; and to provide extra attention to nursing animals.",Strengthening Communities,10016.0,40.7454894,-73.9797093
10,"Comprised of local young professionals who seek to raise awareness, resources, and funds for The Family Center, the Leadership Council celebrates the idea of family with a passionate commitment to serve the needs of families in NYC through the sharing of energy, resources and advocacy.",Strengthening Communities,10018.0,40.754116,-73.9903452
5,"The Momentum Project needs volunteers urgently to help with our dinner program located on East 106th Street in East Harlem, Manhattan, offering a nutritious hot meal and pantry to take home, as well as social services.",Helping Neighbors in Need,10029.0,40.7920271,-73.9445046
10,"Build with Habitat-NYC. Come Pound, Haul, Hammer or Paint at the Habitat-NYC construction site in Brooklyn.",Strengthening Communities,10038.0,40.707671,-74.005764
10,"Starting July 2011. Activities vary week by week, but volunteers will generally assist students in activities including an education enrichment period, singing, computer time, arts and crafts and more. There will also be an all-day trip once a week, on Wednesdays or Fridays.",Strengthening Communities,11354.0,40.754801,-73.832822
5,Volunteers are paired one on one with tutees to help teach and explain the homework assignments that the tutees have had difficulty with.,Helping Neighbors in Need,11219.0,40.6326566,-73.9966075
99,A board member search strategy helps an organization build a strong board of directors that is committed to furthering the organization's mission.,Strengthening Communities,10013.0,40.720942,-73.997929
50,Join us as we restore the beautiful John Kieran Nature Trail and the forest.,Strengthening Communities,10463.0,40.884999,-73.892977
100,"A one day free event in June for children featuring over 25 sports activities, nutrition clinics, health screening, entertainment, and vendors. Volunteers will be integral to this event running effectively and providing a place where children can be introduce to new sports and health education.",Health,11203.0,40.645985,-74.010248
30,What are you doing to honor the 10th anniversary 9/11?  Why not help seniors become better prepared for emergency situations?  Help create and distribute emergency preparedness resources and materials at low income senior housing sites.,Emergency Preparedness,10021.0,40.7701875,-73.9596759
1,Help elementary and middle school aged girls become stronger and healthier by volunteering your time as a soccer coach in an under-resourced Brooklyn community.,Health,11213.0,40.663701,-73.936049
100,"VRC is a liaison between volunteers and the non-profit agencies that depend on volunteer support. We will help match your interests, skills, and schedule availability with a non-profit that needs your help.",Strengthening Communities,10016.0,40.746816,-73.98364
5,Our website would like to include the work of photographers and artists. A wide range of work is welcome that could enhance our site and help you gain exposure. Choose one or more of the following:,Strengthening Communities,10025.0,40.7978043,-73.9675844
4,"Tracking with Excel, followup with foster parent, prescreen for foster care, mailing",Helping Neighbors in Need,10001.0,40.746817,-73.993655
20,Take on leadership and organizational role in set up and execution of halloween carnival in park slope,Strengthening Communities,11215.0,40.673717,-73.983424
30,"Help water and care for the 70,000 new street trees that have been planted across New York City! Join the MillionTreesNYC Stewardship Corps and help keep New York City GREEN by coming to a free MillionTreesNYC stewardship workshop",Environment,11103.0,40.7625484,-73.9137114
1,"Coney Island Community Kitchen, all-volunteer Coney Island nonprofit, providing meals for low-income/under poverty line community members, seeks a part-time Soup Kitchen volunteer cook to prepare meals on Fridays. Must be certified, enjoy cooking and giving back to community.",Helping Neighbors in Need,11224.0,40.576239,-73.988218
20,An RSVP mentor can make a difference in a child’s life and yours.,Education,10010.0,40.739861,-73.9851916
500,Are you looking for ways to be more physically active? Want to help your community get moving?,Health,11101.0,40.7484996,-73.9388176
