vol_requests,summary,category_desc,Postcode,Latitude,Longitude
99,"A logo provides a visual identity that conveys an organization's values, mission, and brand. Visual branding provides a set of guidelines, fonts, and colors, which support an organization's logo and visual identity.",Strengthening Communities,10013.0,40.720942,-73.997929
1,"The Web Editor will be responsible for managing all aspects of the site’s content, which entails a conceptual and detailed plan of new content.",Strengthening Communities,11372.0,40.749193,-73.889702
1,Big Apple Greeter’s Director of Development seeks a part-time Volunteer Grant Writer. The ideal candidate will have a several years of grant-writing experience.,Strengthening Communities,10007.0,40.713001,-74.004181
10,"ClassWish is a nonprofit organization that empowers parents, educators, and local communities to make a positive change in their children's lives by providing them with the supplies they need to learn, grow and excel.",Education,10001.0,40.749794,-73.991486
20,"Career Gear collects men's business clothing, and provides career counseling and mock interviews for clients, who are looking to enter or re-enter the workforce.",Helping Neighbors in Need,10271.0,40.708546,-74.011041
1,"Afro-Asian, Inc. is a New York City based non-profit organization that aims to promote the city’s rich multi- cultural heritage through music by supporting the development of local musicians and to expand access to music education to youth.",Strengthening Communities,10002.0,40.7170829,-73.9893099
50,Work in a classroom to help lead low-income secondary students develop plans to enact change within their communities.,Education,10010.0,40.739861,-73.9851916
15,"Join the Governors Island Alliance on Saturday, May 28th for our seventh annual Family Festival in Nolan Park on Governors Island. Volunteers are needed to help set up and run activities for children ranging from theater games to arts and crafts projects. Please go to Bit.ly/GIAVolunteer to sign up!",Strengthening Communities,10003.0,40.734163,-73.988627
20,Share What YOU Know and Love: Become a Citizen Teacher!,Education,10005.0,40.706186,-74.010907
1,Need yoga instructor for adolescents in the inpatient psychiatry unit at Bellevue Hospital.,Health,10016.0,40.739173,-73.976862
20,Knitting Project,Strengthening Communities,10013.0,40.72631,-74.00749
20,This volunteer opportunity is great for people who are interested in volunteering in a university environment with graduate and undergraduate college students.,Education,10010.0,40.739861,-73.9851916
4,"The WorldofMoney.org has a five year of a proven track record of delivering empowering financial and business education to underserved youth, ages 12 - 18.",Strengthening Communities,10036.0,40.7594193,-73.9892203
1,NYC Parks and Recreation seeks your participation to enrich our recreation facilities!   Shape Up New York is a free fitness program for all ages and is looking for additional instructors at Al Oerter Recreation Center. Volunteer opportunities are available for a variety of classes and activities...,Health,11355.0,40.751616,-73.834155
4,Figure Skating in Harlem is a pioneering non-profit organization that provides girls ages 6-18 with vital educational and skating opportunities that build self-worth and promote physical well being and academic achievement.  Your work will benefit girls from a low-income community.,Education,10027.0,40.8104656,-73.9505422
10,"You will ride one of the various routes (15, 30, 45, 62, 100 miles)  to see order is maintained, any emergencies be addressed, and any questions that the riders may have be answered.",Strengthening Communities,10001.0,40.747629,-73.99306
20,Please join us and the PAL kids for ice skating at Riverbank Park. It's a great way to enjoy the final days of winter and for a very good cause! Volunteers are kindly asked to pay for their expenses on the day. Admission to rink and skate rental are $5.00 and $6.00 respectively.,Strengthening Communities,10026.0,40.806654,-73.955649
25,Join us for a painting project at MS131 in Chinatown on September 10th 2011. As part of our day of service in remembrance of 9/11.,Education,10038.0,40.71187,-74.00641
8,"Join the Department of Parks and Recreation at Far Rockaway Beach on July 24th for a Sand Castle Contest.  Time commitment will include morning and afternoon hours.  Volunteers needed for crafts, face painting, refreshment distribution and contest judging.",Strengthening Communities,11415.0,40.710954,-73.835147
5,"A day of fun and games, giveways for the entire community.",Strengthening Communities,11203.0,40.656162,-74.00901
15,"ARTs East New York Inc. is looking for open-minded, motivated volunteers with an interest in the arts and community development to further the mission of our organization. Interns should have strong work ethic and willingness to explore the idea of using the arts as a tool for change.",Strengthening Communities,11207.0,40.667112,-73.885169
3,"We are currently accepting applications for FALL 2011  Volunteers are needed weekdays to assist in our pharmacy with packaging, labeling, delivering medications and also to perform minor filing and other clerical work .",Helping Neighbors in Need,10025.0,40.7978043,-73.9675844
40,El Museo del Barrio needs your help for a wide array of volunteer tasks!,Strengthening Communities,10029.0,40.793072,-73.951992
3,Part of the Solution (POTS) Legal Clinic (www.potsbronx.org) serves low-income residents of the Bronx.,Helping Neighbors in Need,10458.0,40.865714,-73.886305
20,The Police Athletic League of New York City seeks skilled volunteers to provide vocational training for teens and young adults.,Helping Neighbors in Need,10003.0,40.7313422,-73.9887282
99,"Market analysis helps an organization understand the attractiveness of a market, its evolving opportunities, and threats in the external market as they relate to an organization's internal strengths and weaknesses.",Strengthening Communities,10013.0,40.720942,-73.997929
3,Assist staff by providing support in caring for babies.,Helping Neighbors in Need,10010.0,40.739861,-73.9851916
10,"Give the gift of confidence, freedom, independence, and a greener, healthier society to others through teaching them how to ride bicycles!",Health,10115.0,40.811101,-73.964168
1,Looking for someone  to grow the impact of our programs by getting involved in all aspects of our fundraising operations with a focus on fundraising management and development.,Strengthening Communities,11215.0,40.677354,-73.984973
15,"Help us spread Fibar mulch on paths in the park, to create a safe walking surface.  September 17, from 2pm - 5pm.",Environment,10010.0,40.736274,-73.97468
6,"The program seeks to match young adults, age 18 to 24 who have aged out of the foster care system, with professional mentors.",Education,10010.0,40.739861,-73.9851916
20,"Become a teaching assistant for the day by helping an LP teaching artist run an outdoor art workshop at a New York City laundromat. Other opportunities available, too!  Most workshops are held at a Harlem laundromat, but we recruit volunteers for events in other locations, as needed.",Strengthening Communities,10026.0,40.8030637,-73.952906
10,Helping those to help themselves,Helping Neighbors in Need,10013.0,40.72631,-74.00749
50,"Thousands of New Yorkers aren’t able to dig out the snow; many need help shoveling snow, bringing groceries into their home, or traveling to mass transit hubs.  If you’re an able-bodied New Yorker with a few minutes to spare, please find an opportunity in your neighborhood below.",Helping Neighbors in Need,10007.0,40.713265,-74.007063
8,Lenox Hill Neighborhood House is the oldest and largest social and educational services organization on Manhattan's Upper East Side.,Helping Neighbors in Need,10018.0,40.754116,-73.9903452
10,Don’t need to have a green thumb but it doesn't hurt. We need muscle power to help maintain several raised beds filled with vegetables and flowers.,Environment,10001.0,40.746817,-73.993655
1,We are looking for help with the successful re-launch of our brand with an effective roll out strategy and marketing plan.,Strengthening Communities,11207.0,40.667112,-73.885169
1,We are looking for a social-media and web-savvy intern/volunteer to help us launch and administer an online story contest to help build our brand awareness and get more potential volunteers and donors engaged with our cause.,Strengthening Communities,10003.0,40.7313422,-73.9887282
15,"The Chapter Ambassadors will promote Society events, programs and outreach events as program support and as a Society representative at various events and programs directly benefiting people living with MS.",Health,10017.0,40.753074,-73.972753
1000,icouldbe.org is an award-winning online mentoring program connecting middle and high school students from diverse communities with mentors from across the country.,Education,10010.0,40.739861,-73.9851916
2,"World Cares Center is looking for individuals to help us with branding initiatives and producing print materials (pamphlets, brochures, etc.)for marketing our programs and initiatives.",Strengthening Communities,10018.0,40.753612,-73.992417
9999,"From accounting to fundraising to marketing to strategy, Catchafire makes it easy for every professional to use their skills for good.",Strengthening Communities,10016.0,40.7454894,-73.9797093
15,"Provide daily guidance to campers, lead camp activities, assist other counselors, actively participate with campers, plan and direct a portion of daily activities, maintain attendance records and other required paper work. Assume responsibility for safety and discipline of campers.",Strengthening Communities,11365.0,40.739873,-73.788239
3,We are having a conference/celebration later this year and are looking for volunteers with fundraising experience to help us.,Strengthening Communities,10028.0,40.7765642,-73.9537245
30,"A mentor’s main purpose is to help a child define individual goals and find ways to achieve them.  Since the expectation of each child will vary, the mentor’s job is to encourage the development of a flexible relationship that responds to both the mentor’s and the child’s needs.",Education,11216.0,40.688289,-73.952216
2,"Clerical Assistanted wanted.  Assist in filing, typing, record keeping, some receptionist duties.",Strengthening Communities,10001.0,40.746817,-73.993655
5,"Public Relations: for our national publicity campaigns: press releases and other marketing materials and contact with major media, including newspapers, magazines, radio, television and the internet.",Strengthening Communities,10025.0,40.7978043,-73.9675844
20,Spend one hour this Saturday learning how to change others' lives by teaching them how to ride a bicycle!,Helping Neighbors in Need,10115.0,40.811101,-73.964168
10,Year round or summer internship in NYC or virtually,Education,10001.0,40.749794,-73.991486
20,"Facilitate an IT focused course, there are opportunities for basic, intermediate and specialized IT program facilitation in addition to assistance with community engagement and outreach.",Strengthening Communities,11238.0,40.6810526,-73.9635903
6,We are looking for enthusiastic volunteers to teach our ESL classes for the fall semester. No experience is necessary and training is provided!,Helping Neighbors in Need,11209.0,40.63238,-74.021444
99,A promotional video gives an organization the opportunity to communicate what the organization does and why it is important to a wide audience in an engaging manner. It offers an avenue for reaching potential patrons as well as people who may not yet be familiar with the organization.,Strengthening Communities,10013.0,40.720942,-73.997929
100,"Volunteer for 6th Annual Halloween Carnival set up and event in Park Slope, Bklyn.",Strengthening Communities,11214.0,40.6020415,-73.9966359
100,"Sign up to volunteer at inMotion's Story by Story stair climb fundraiser on Thursday, October 6th!",Helping Neighbors in Need,10018.0,40.753716,-73.987068
15,"Stop 'N' Swap reduces NYC's waste by finding new homes for unwanted, but usable items.  Help sort, fold and display items to make this a fun free reuse experience for all.",Environment,11238.0,40.6810526,-73.9635903
99,"A social media plan helps an organization develop a presence in the digital sphere, through social media sites like Facebook, Twitter, and others. Social media helps an organization interact and engage with online audiences to increase awareness about its mission, all on a shoestring budget.",Strengthening Communities,10013.0,40.720942,-73.997929
5,Pack backpacks for our Back to School distribution.,Strengthening Communities,11221.0,40.691698,-73.911714
10,Volunteers are needed to participate in Met Council’s Passover Food Distribution for families affected by domestic violence.,Helping Neighbors in Need,11230.0,40.6215047,-73.965623
1,Girls Inc. of NYC seeks a HTML Curriculum Design Intern to supplement and expand our HTML curriculum for girls in grades 6 – 11.,Strengthening Communities,10005.0,40.70438,-74.006427
50,"Thousands of New Yorkers aren’t able to dig out the snow; many need help shoveling snow, bringing groceries into their home, or traveling to mass transit hubs.  If you’re an able-bodied New Yorker with a few minutes to spare, please find an opportunity in your neighborhood below.",Helping Neighbors in Need,10007.0,40.713265,-74.007063
10,Met Council is looking for people passionate about helping others make healthier choices. We need your help to design and facilitate workshops to be held in our senior centers among other locations.,Health,10001.0,40.7484356,-73.9940338
20,Tutors needed in after school programs for high school and junior high school students in Harlem.,Education,10010.0,40.739861,-73.9851916
100,"Civil Air Patrol has three congressionally mandated missions: Emergency Services, Aerospace Education and the Cadet Program.",Strengthening Communities,11213.0,40.672713,-73.936924
4,"Metropolitan Council on Jewish Poverty is one of New York's largest human services agencies, providing more than 100,000 New Yorkers with critical services in their fight against poverty and its effects every year.",Health,10016.0,40.744241,-73.981285
20,We are currently in the process of recruiting academic tutors for our after school programs. The time commitment is not strenuous. It is also a great opportunity to gain experience working with youth.,Education,10029.0,40.7920271,-73.9445046
20,"Heights and Hills is recruiting volunteers to support our elderly clients through a range of activities including weekly companionship, and help with one time tasks such as setting up email accounts or hanging drapes.",Helping Neighbors in Need,11201.0,40.692217,-73.986665
1,"Intern will have the opportunity to gain experience in many aspects of health education such as: outreach activities, developing culturally specific program materials, and hands on program implementation.",Health,10016.0,40.762131,-73.97036
25,"Housing Works, Inc. is looking to partner with corporate volunteer groups to volunteer at our Processing and Donations Center in Long Island City Queens. We can accommodate large groups and welcome help Mondays through Saturdays.",Strengthening Communities,10012.0,40.72496,-73.997157
100,"Inspire one high school Future Fellow by partnering with them for one school year. Together, during weekly 90 minute meetings, you will discover a passion, build a project, and spread inspiration throughout the school and community.",Education,10011.0,40.740887,-73.9995464
3,Conservation nonprofit seeks virtual volunteers to assist in building its social networks and online presence through web 2.0 options.,Strengthening Communities,11231.0,40.683929,-73.998659
10,"The World Science Festival, one of the largest and most prestigious gathering of scientists and science enthusiasts, is currently seeking volunteers to assist with administrative office work.",Strengthening Communities,10115.0,40.811101,-73.964168
20,"Learning Leaders, the nation’s oldest and largest school volunteer and parent engagement, is currently seeking volunteers to serve as tour guides at the Brooklyn Museum with our ArtWorks program.",Strengthening Communities,11238.0,40.671835,-73.963042
15,Volunteers are needed to pitch in and help reorganize a library for low-income seniors in Brooklyn. Help freshen up the those dusty shelves and have some fun!,Strengthening Communities,11224.0,40.5798314,-73.9987552
15,Provides instruction to camp participants for indicated activity or subject. Teaches the associated knowledge and skills and assists campers in achieving activity or lesson goals.,Strengthening Communities,11365.0,40.739873,-73.788239
100,Help with a forest restoratio project along the John Muir Trail of Van Cortlandt Park,Strengthening Communities,10463.0,40.895865,-73.892294
1,Accountant with non-profit experience,Helping Neighbors in Need,11102.0,40.771029,-73.9247023
30,"Volunteers Needed for 4-Mile Charity Run/Walk for Cancer Research in New York City's Central Park on Sunday, July 17, 2011 (7:00 a.m. to Noon)",Strengthening Communities,10128.0,40.7817366,-73.9511409
22,"Receive, sort, and display donated Halloween costumes!",Strengthening Communities,10007.0,40.713797,-74.005494
4,Retail sales support for the Shop@RMA.,Strengthening Communities,10011.0,40.740887,-73.9995464
10,Assist staff in providing program and transportation to clients in a fun and challenging environment.,Helping Neighbors in Need,11215.0,40.666966,-73.990448
2,We are looking for an excited and organized individual to help us in our day to day activities. Join a dynamic team to help prevent suicide.,Helping Neighbors in Need,10004.0,40.706449,-74.012761
1,Come and share your dancing techiques,Health,11239.0,40.6540732,-73.8752529
100,Create cards at home for this special event.  Mail cards to DOROT by 9/1/11,Strengthening Communities,10024.0,40.78623,-73.9756746
20,Coney Island Prep has a number of opportunities for groups of all sizes that can be tailored to meet the specific needs and interests of corporations.,Strengthening Communities,11224.0,40.5798314,-73.9987552
1,"BCS is seeking a motivated and outgoing individual with a strong interest in working with adults with disabilities in our BKLYN UNLTD workshop, our sub-assembly packing, shipping and labeling company.",Strengthening Communities,11217.0,40.687759,-73.982898
200,"Concern’s annual Spring Run needs volunteers! Looking for groups & individuals! Concern Worldwide US, an international humanitarian agency committed to fighting extreme poverty around the world, needs over 100 volunteers to help spread the word and join us for a great day out in Central Park!",Strengthening Communities,10017.0,40.750245,-73.976909
10,Our Annual Back to School Kickoff,Strengthening Communities,11233.0,40.680383,-73.909948
5,"Attention all filmmakers, producers, and editors: The Mayor’s Office of Adult Education and the New York City Council need your help! We are looking for volunteers to provide technical assistance, on-set filming, and/or post-production editing for our new initiative, YouCanToo!",Strengthening Communities,10038.0,40.710353,-74.004007
4,"Each year on the first day of summer, public spaces in all five boroughs become informal musical stages for all New Yorkers, amateurs and professionals, to perform for friends, neighbors, and passers-by, turning the city into a festival of live music making.",Strengthening Communities,10002.0,40.7170829,-73.9893099
5,We are seeking Professionals in a variety of industries to participate in roundtable discussions with students! We are also seeking Professionals who are interested in conducting a workshop for our scholars on Networking.   Networking: People skills to get you where you want to go!,Education,10027.0,40.808639,-73.948582
100,Learn CPR. Save a life. Use your BLANK for good.,Emergency Preparedness,11236.0,40.6246,-74.026744
36,Help our neighbors up north by staffing canned food drives at one of our Brooklyn farmer's markets.,Helping Neighbors in Need,10007.0,40.713265,-74.007063
8,KFT is seeking Computer Skills Tutors to instruct fifteen 3rd to 6th grade students at P.S. 59 in basic and relevant computer skills.  The Computer Skills Tutor will be part of a team of tutors who will work together to present classroom computer lessons and work in small groups with the students.,Education,10010.0,40.74053,-73.981899
20,Help immigrants and new Americans practice their English through some Coffee & Conversation!,Helping Neighbors in Need,11238.0,40.668597,-73.976861
70,"East Harlem Tutorial Program is looking for volunteer tutors, reading partners for elementary school kids, and college mentors for our graduating seniors!!",Education,10029.0,40.790263,-73.942688
2,Experienced mural artist needed to create a special mural for pre-schoolers,Strengthening Communities,10001.0,40.746817,-73.993655
50,As a Leader you will serve as a mentor to a group of girls. Opportunities available in all 5 boroughs!,Strengthening Communities,10010.0,40.739861,-73.9851916
5,"The Administrative Support Volunteer will assist QSAC staff in achieving the mission of the agency.  Volunteers are needed to help with office tasks such as filing, data entry, answering phones, making calls & follow up appointments, making copies, sending faxes, and general office duties.",Strengthening Communities,10001.0,40.7484356,-73.9940338
99,"Market research can help an organization determine the most effective programs to maintain and pursue once it has developed its strategic vision, mission, and aspirations. Market research can consist of interviews with key stakeholders and surveys as well as literature reviews of existing research.",Strengthening Communities,10013.0,40.720942,-73.997929
1,NYLAG is currently looking for administrative interns to work with the executive assistant to the president of organization on special projects.,Helping Neighbors in Need,10004.0,40.70447,-74.009406
1,Do you speak a South Asian language?  Are you interested in empowering NYC immigrants through community outreach and education?,Helping Neighbors in Need,11372.0,40.747993,-73.888827
5,The Museum Visitor Services volunteer greets visitors to the museum and provides assistance as needed.,Strengthening Communities,10128.0,40.785298,-73.957263
25,Help kids from low-income families start the school year on a positive note!,Helping Neighbors in Need,10458.0,40.865714,-73.886305
5,"PAL Brownsville Beacon Center (BBC) seeks dedicated Cosmetology and Barber Volunteer Instructors to educate participants in different areas and forms of hair care and beauty. Instructor must be able to instruct, explain, and demonstrate techniques and methods high school aged students.",Education,11212.0,40.656068,-73.907245
2,NYC Parks and Recreation seeks your participation to enrich our recreation facilities! Shape Up New York is a free fitness program for all ages and is looking for additional instructors at Greenbelt Recreation Center in Staten Island.,Health,10029.0,40.793292,-73.951826
2,"Administrative Assistant need to help with Filing, answering the phones and greeting clients.",Strengthening Communities,10001.0,40.746817,-73.993655
150,"Be a part of the 2011/2012 Penny Harvest!   Join us and hundreds of amazing volunteers to make Penny Harvest Leader Pin. The pins -- made out of pennies -- will be given to 30,000 Penny Harvest Leaders across the country and will inspire the 2011/2012 Penny Harvest campaign.",Education,10024.0,40.787556,-73.971407
5,This position involves membership recruitment and and encouraging greater membership support for the Museum.,Strengthening Communities,10128.0,40.785298,-73.957263
20,Please join us for a bowling event with the PAL kids! The group consists of children ranging from 9-13 years. We will have 2 hours of some 'healthy competition' and then grab some pizza afterwards. It's will be a fun day for all! For volunteers who wish to participate in bowling the cost is $13.50.,Strengthening Communities,10026.0,40.806654,-73.955649
1,":  Big Apple Greeter is looking for an experienced volunteer to perform a feasibility study to determine whether a walkathon is right for us.  This person will work under the guidance of the Executive Director, the Development Director, and the Director of Volunteers and Programs.",Strengthening Communities,10007.0,40.713001,-74.004181
1,Girls Inc. seeks a volunteer to support a fashion workshop for high school girls at The Urban Assembly Institute of Math and Science for Young Women in Downtown Brooklyn.,Education,11201.0,40.694682,-73.988853
15,"Stop 'N' Swap reduces NYC's waste by finding new homes for unwanted, but usable items.  Help sort, fold and display items to make this a fun free reuse experience for all.",Environment,11372.0,40.7514126,-73.8832908
20,Fundraising for ResoNations 2011: An International Telematic Music Concert for Peace - United Nations/Nairobi. Telematic music is real-time performance via the internet. Concert for International Year for People of African Descent declared by UN High Commission for Human Rights.,Strengthening Communities,10003.0,40.7313422,-73.9887282
15,"Reach Out and Read makes literacy promotion a standard and important part of pediatric primary care, so that children are able to grow up with access to books and are able cultivate a love of reading early on.",Education,10453.0,40.8523117,-73.9120143
6,"Momentum has a hot lunch and pantry program open to all in need that operates on Tuesdays at Lexington Avenue and East 54th Street.  We have no volunteer groups at the lunch program and need volunteers to help with pantry, serving food and site set up.",Helping Neighbors in Need,10022.0,40.758698,-73.970744
