vol_requests,summary,category_desc,Postcode,Latitude,Longitude
5,"Volunteer in one of our office to assist with duties such as Filing, Answering Phones, Word Processing, and Excel.  We will try to accomindate any special interest.",Strengthening Communities,10025.0,40.7978043,-73.9675844
20,"Jumpstart at St. John's University is looking for volunteers to come read about  friendship, make friendship bracelets and collages with preschool children!",Education,11367.0,40.727194,-73.822075
99,"Professional photographers can capture images of supporters at fundraisers, volunteers on a workday, or people whom the organization serves. These photographs can be used in promotional materials, for presentations, or on organization websites.",Strengthening Communities,10013.0,40.720942,-73.997929
5,"CHOOSE FROM 1 OR BOTH: Computers/Technical support - Windows desktop support and system administration, networking, software updating and configuration, & office equipment troubleshooting  Website Design & development - website editing, HTML and database programming, site management & promotion",Strengthening Communities,10025.0,40.7978043,-73.9675844
99,"A well-designed technology plan helps an organization increase its efficiency in daily operations. Yet, many nonprofits and social enterprises face significant challenges in determining what technology services, applications, and infrastructure to put in place",Strengthening Communities,10013.0,40.720942,-73.997929
99,A human resources strategy assesses an organization's human resources in order to provide recommendations to streamline operations and increase staff capacity.,Strengthening Communities,10013.0,40.720942,-73.997929
5,"Volunteers needed to work as a team, planning events for nonprofit organization.",Strengthening Communities,11429.0,40.713236,-73.735594
15,Help JASA clients learn how to make healthier choices!,Health,10001.0,40.7484356,-73.9940338
30,"W!se is seeking volunteers to lead seminars for the w!se Institute at the High School for Economics and Finance in downtown Manhattan.  Seminars are held every Wednesday from 1:24 to 2:24 for eight weeks.  The first module of seminars would start Wednesday, September 21.",Education,10006.0,40.7083766,-74.0134033
3,Maintain the greenhouse   Work with residents one-one or in small groups and plants.,Environment,10040.0,40.854783,-73.927909
10,"Change a community!  Give the gift of self confidence, independence, health, and a smaller carbon footprint! Volunteer for Bike New York!",Education,10115.0,40.811101,-73.964168
20,"This volunteer event will be held in Bayswater Park, Queens, on June 25th.  20 volunteers are needed to assist with crafts, games, face painting and popcorn making.",Strengthening Communities,11415.0,40.710954,-73.835147
100,Come join the Friends of Van Cortlandt Park for a day full of fun activities sure to get you outside and and moving.,Strengthening Communities,10463.0,40.895865,-73.892294
10,"Change a community!  Give the gift of self confidence, independence, health, and a smaller carbon footprint! Volunteer for Bike New York!",Health,10115.0,40.811101,-73.964168
100,Volunteer with New York Cares to clean-up after Hurricane Irene,Emergency Preparedness,10001.0,40.7484356,-73.9940338
30,The primary role of the volunteer dispatcher is to process emergency calls for help efficiently and smoothly. A dispatcher required to take information from a caller regarding a medical emergency;  The Dispatcher is responsible for receiving and dispatching emergency calls to field units.,Emergency Preparedness,11214.0,40.610245,-74.003155
500,"The Oxfam Action Corps is a group of dedicated volunteers that raise awareness by holding events and reaching out to people in our neighborhoods, town events, rock concerts – and, most importantly, in the halls of Congress.  Sign up by February 14:  http://www.oxfamactioncorps.org",Strengthening Communities,2114.0,42.8547788,-78.8087449
10,Academic tutors needed for one-on-one tutoring sessions on Tuesday and Thursday afternoons.,Education,10031.0,40.819196,-73.950221
15,"Help make health care reform work!  We assist NY consumers with questions or problems with their health insurance get the answers and help they need.  We are seeking health care advocates to work on the helpline during business hours.  Experience not necessary,  but passion is a must!",Health,10010.0,40.739861,-73.9851916
2,With four levels of Women's ESL classes running at the AAANY we are looking for a dedicated ESL Volunteer to help us strengthen our upper level Advanced Course.,Helping Neighbors in Need,11209.0,40.63238,-74.021444
5,"The Client Care Services Volunteer would be assigned to the New York City Family Justice Center, Queens (QFJC).  Flexible schedule (no less than 4 hours per week)",Helping Neighbors in Need,11415.0,40.713732,-73.826122
5,"The Leukemia & Lymphoma Society is seeking energetic, personable, and detail-oriented volunteers to assist the Operations Department.",Strengthening Communities,10016.0,40.762131,-73.97036
30,"Interested in experiencing the smells, sounds, and sights of the Astoria Broadway Street Fair while still serving your community, your city, and the environment? Then sign up to volunteer with us on Sunday, September 25!",Environment,10007.0,40.713797,-74.005494
500,Are you and your family prepared for an emergency? Join the Red Cross' Centennial Circle for a free Ready NY presentation and receive a FREE Go Bag! Presentations last for 45 minutes and will be held in English and Spanish.,Emergency Preparedness,10035.0,40.7946297,-73.9416057
5,The Latino College Expo is a college fair which takes place in the spring. The organizers of the Latino College Expo are looking for volunteers to help with the pre-Expo activities which include recruiting colleges and high schools.,Education,10461.0,40.8458471,-73.8411421
2,We are currently restructuring our non-profit organization and looking for someone who has experience in writning business plans and knowledge of the non-profit sector. Having an interest in sports and development is a huge plus!,Strengthening Communities,10024.0,40.78623,-73.9756746
10,Help decrease social isolation within the senior citizen population by visiting with a senior friend once a week for about an hour.,Helping Neighbors in Need,11427.0,40.72821,-73.7487166
100,Enjoy a taste of Van Cortandt Garden,Strengthening Communities,10463.0,40.895865,-73.892294
99,A press list is a list of media outlets and contacts that an organization wants to target on an ongoing basis or a list designed for a specific news announcement. This is a list of key reporters and publications that are relevant to an organization and the types of news it wishes to publicize.,Strengthening Communities,10013.0,40.720942,-73.997929
50,"Public carnival in Park Slope for families with games, crafts, and activities.",Strengthening Communities,11215.0,40.6672949,-73.9838984
4,We are seeking a new Coalition Leader to co-lead the Coalition as we enter into the next phase of our project and continue to expand. A job description can be found below.  Please contact us  envisionwilliamsburg@wiggiomail.com if you're interested and meet the criteria identified below.,Strengthening Communities,10301.0,40.641324,-74.075936
8,Do you want to make a difference against human trafficking? Do you want to see some of the ins and outs of putting together a very large fundraising event? Read on.,Strengthening Communities,10004.0,40.706045,-74.013096
3,"Looking to attain a professional grant writer to assist with fundraising for athletic, educational, professional and life skill development organization.",Strengthening Communities,10010.0,40.740596,-73.983938
250,Help clean up tree limbs that came down during Hurricane Irene.,Emergency Preparedness,11693.0,40.5992482,-73.8180932
5,"Arts management, creative writing and fine art.",Strengthening Communities,10025.0,40.7978043,-73.9675844
35,NYJTL is the designated promoter and beneficiary of this professsional tennis tournament held in Crotona Park in the Bronx.,Strengthening Communities,10460.0,40.839934,-73.8788519
99,"Databases are necessary to manage and analyze large amounts of data and maintain relationships amongst different kinds of data (eg. a parent and his/her children, a building and its tenants).",Strengthening Communities,10013.0,40.720942,-73.997929
12,"Tutors are the backbone of our academic enrichment program, we are currently looking for tutors for many subjects (math, science, English, history, language, SAT Prep, religion).",Education,11238.0,40.6810526,-73.9635903
1,Tutor Staff in using basic functions of MS Word,Helping Neighbors in Need,10004.0,40.706449,-74.012761
40,Join us for our June events!,Helping Neighbors in Need,10007.0,40.7141085,-74.0083369
10,Paws of Hope Foundation seeks New York State licensed drivers with truck or van or access to truck or van for petfood bank.,Helping Neighbors in Need,10156.0,42.922261,-78.3543125
34,"Volunteer at the Fall Harvest Festival in Highland Park, Queens.",Strengthening Communities,11415.0,40.710954,-73.835147
5,Become a Bike New York volunteer and teach adults and kids how to ride bicycles!,Education,10115.0,40.811101,-73.964168
2,"We are New York City’s largest girls-only youth and leadership development program where girls learn to lead with courage, confidence and character to make their communities and the world  a better place.",Education,10035.0,40.7946297,-73.9416057
25,Bronx One on One Mentoring (BOOM) seeks to make a difference in the life of a child by providing amazing mentors who can serve as positive role models and guides in their lives.,Education,10468.0,40.8653155,-73.9003369
30,The NYAWC Volunteer Council proudly presents:  Spring Volunteer Information Forum.  - Hear first-hand from current volunteers about volunteer activities - Mingle and chat with like-minded people - Refreshments provided,Strengthening Communities,10002.0,40.715738,-73.996367
5,"Assist in filing, mailings, and various clerical duties",Strengthening Communities,11217.0,40.687759,-73.982898
30,"NYC Parks is looking for teenagers or teen programs who are interested in cleaning up a local parkland by removing debris, collecting recyclables and taking care of greenery.",Environment,11415.0,40.710954,-73.835147
99,"A business plan is a document that helps you communicate your goals and the plan for how you're going to accomplish them to external stakeholders, such as potential investors, funders, advisers and Board members.",Strengthening Communities,10013.0,40.720942,-73.997929
15,"From the Cloisters to Wall Street, WoM youth teams will receive clues, then dash to each business, historical landmark, cultural institution or financial institution where they will perform tasks.",Education,10036.0,40.7594193,-73.9892203
15,"In addition to our fitness classes, which provide many health benefits, we are expanding our nutrition education programs. We are looking for volunteers to provide nutritional education/counseling to our constituents so that they can reach the levels of health and well-being that they strive for.",Health,10029.0,40.7920271,-73.9445046
1,Big Apple Greeter is currently seeking a Special Projects Manager to work with the Executive Director and the Founder.  This is an executive-level experience for the right individual interested in working in the non-profit world.,Strengthening Communities,10007.0,40.713001,-74.004181
99,A press release is a written communication directed at members of the media containing information about something newsworthy an organization is doing. A press release announces this information in an exciting and compelling way to encourage media outlets to pick up the story.,Strengthening Communities,10013.0,40.720942,-73.997929
1,"Turtle Bay Music School seeks a volunteer to tutor staff members in basic conversational Spanish for 1-2 hours per week.  Must be a fluent Spanish speaker, preferably with some teaching experience.  Interest and enthusiasm for music and community are a plus.",Helping Neighbors in Need,10022.0,40.7583228,-73.9679848
20,"On Saturday, June 11, 2011, the Mayor’s Office of Immigrant Affairs together with the City University of New York's Citizenship Now! and the Legal Aid Society is hosting a service event to help eligible Haitian nationals apply for Temporary Protected Status (TPS) or their extension for TPS.",Helping Neighbors in Need,11203.0,40.649091,-73.9340076
15,"MASA-Mexed Inc. is seeking dedicated volunteers to provide tutoring services to elementary- and middle-school students at its South Bronx community center, particularly on Tuesday evenings.",Education,10454.0,40.8076603,-73.9182931
100,Volunteers needed to help remove invasive plants and plant native trees and shrubs at various locations in Van Cortlandt Park.,Environment,10463.0,40.895865,-73.892294
50,"Come out and help us plant our garden, learn about what we are growing and turn and sift our compost bins.",Strengthening Communities,10463.0,40.884999,-73.892977
99,"Merchandise design helps an organization create professional designs for t-shirts, pins, hats or giveaways that include an organization's logo or a logo created for a special event.",Strengthening Communities,10013.0,40.720942,-73.997929
500,Looking for a way to give back and change a life?   Become a Mentor today!    Send one weekly email on an interesting topic that iMentor provides  See your mentee once a month for two hours at an iMentor organized group event.   Click this posting to learn more!,Education,10004.0,40.70618,-74.01125
20,"We are looking for volunteers to help us execute a Cinco de Mayo celebration, supporting Global Workers programs and services",Strengthening Communities,11238.0,40.673023,-73.962829
2,"Volunteer your time to work alongside an all-girls, high school rowing team, helping them succeed in academics during after-school time.",Education,11101.0,40.74673,-73.951921
2,The Fundraising Coordinator will design and coordinate fundraising activities.,Strengthening Communities,11203.0,40.652712,-74.010851
50,Memorial Day Celebration Kicks-Off Clothing Drive for Veterans Seeking Employment,Strengthening Communities,10013.0,40.716696,-74.004163
15,East Harlem Scholars Academy is looking for homework helpers and tutors for our brilliant kindergarten and first grade students!,Education,10029.0,40.790263,-73.942688
10,"PortSide NewYork is sponsoring a multimedia exhibit on the Marine response to 9-11, shown aboard the LILAC at Pier 25 in Hudson River Park during Sep. and Oct. Volunteers are needed to extend the hours the exhibit is open to the public.",Strengthening Communities,10013.0,40.7191894,-74.0023997
1,Pajama Program is currently seeking an individual with experience in:  - Fundraising events  - Identifying and cultivating long-term supporters and major gift donors who are aligned with Pajama Program's mission,Helping Neighbors in Need,10016.0,40.7454894,-73.9797093
20,On June 25th the NYC Parks will be hosting Adventures NYC and the GreenTeam will be there keeping it green. Please sign up and help out with this fun and environmentally friendly opportunity.,Environment,10065.0,40.7660142,-73.9646852
40,"There are 16,000 children actively in foster care and only 12,000 foster parents. We are helping to try to increase homes for foster children. The Month of May is foster care month.  so we will be discussing how foster care youth need support services and other issues that need to be addressed.",Strengthening Communities,10027.0,40.802461,-73.949374
1,"NYC Parks and Recreation seeks your participation to enrich our recreation facilities! Shape Up New York is a free fitness program for all ages and is looking for additional instructors at St. Mary’s Recreation Center (St. Ann’s Avenue at East 145th street, Bronx, NY 10455)",Health,10455.0,40.811972,-73.914275
6,Several volunteers are needed for an upcoming cocktail party benefiting the Children's Museum of the Arts.,Strengthening Communities,10013.0,40.72064,-73.998568
2,Services for the UnderServed (SUS) is currently seeking volunteers interested in becoming an on-demand Driver.  Volunteers are needed occasionally to drive staff and other individuals to program sites located throughout New York City.,Helping Neighbors in Need,10001.0,40.746817,-73.993655
10,"Tutors are needed for our youth program Union East After 3. Subjects include math, science, english, spanish, and history.",Education,10029.0,40.786574,-73.948303
1,Help our seniors express themselves through painting!,Strengthening Communities,10001.0,40.7484356,-73.9940338
10,Help Met Council clients practice their networking skills.,Helping Neighbors in Need,10038.0,40.707116,-74.007329
1,We are in need of a Help Desk Intern to help our engineers solve the issues of our end users in a more timely fashion.,Strengthening Communities,10017.0,40.753074,-73.972753
2,The director of public relations is the person who represents and is responsible for educating and promoting awareness of our agency and it services to the community.,Strengthening Communities,11213.0,40.674103,-73.929644
1,Serve as the first point of contact for the Connect-to-Care program.,Strengthening Communities,10013.0,40.726623,-74.007753
20,"Assist farmers with weeding, mulching, planting, and harvesting in our two acre vegetable production.",Health,11004.0,40.748163,-73.719431
10,Publicolor engages underserved students in their education and to catalyze change by empowering them and other residents of inner city communities to transform their environments through the power of color and collaboration.,Strengthening Communities,10001.0,40.7484356,-73.9940338
10,"Sales Associate, Sorting Clothing, Inventory; volunteers needed in all of their stores throughout Manhattan and in Brooklyn.",Strengthening Communities,10010.0,40.739861,-73.9851916
12,"The representative will phone outside organizations to promote awareness of upcoming events and seek out participation from local businesses, community based organizations and individuals.",Helping Neighbors in Need,11416.0,40.689418,-73.838575
10,Has math always come easily to you?  Do you know what prepositions and adjectives are?  Are you an expert on ecosystems?  Well . . . have you ever considered sharing your knowledge by becoming a tutor for children in need?,Education,10038.0,40.707116,-74.007329
15,"(CNYCN) and its partners are now organizing 2011 Rise Up & Stay Put! Saturday, April 23 at York College in Queens, and a future date and location in Brooklyn this summer.",Helping Neighbors in Need,11451.0,40.700569,-73.796573
3,We are in need of volunteer exercise teachers to instruct our members at our H.E.S. and Mill Basin Senior Centers.,Health,11206.0,40.632808,-73.89122
100,"City of New York Department of Parks & Recreation Annual Winter Festival featuring Cross Country Skiing, Snowboarding, and Snowshoeing!",Strengthening Communities,10065.0,40.767711,-73.970516
20,"The Trevor Lifeline, 866.4.U.TREVOR (866.488.7386), is the only nationwide, around-the-clock crisis and suicide prevention lifeline for lesbian, gay, bisexual, transgender and questioning (LGBTQ) youth.",Helping Neighbors in Need,10038.0,40.707116,-74.007329
50,Projects throughout the Park will include tree plantings and invasive plant removal.,Strengthening Communities,10463.0,40.884999,-73.892977
4,"The Police Athletic League seeks volunteers to imput survey data on Wednesday, May 18 from 10:00 am to 12:00 pm in Manhattan!",Strengthening Communities,10003.0,40.7313422,-73.9887282
5,Early morning and overnight volunteers needed at a homeless shelter.,Helping Neighbors in Need,10010.0,40.739861,-73.9851916
100,"Climb to the Top is a unique stair climbing event hosted by the National MS Society, NYC-SNY Chapter that will take place n Sunday, February 27, 2011 as 1,000 participants will climb 66 flights of stairs to help create a world free of MS.",Health,10112.0,40.758754,-73.978692
20,"World Cares Center is seeking up to 20 volunteers to participate in an emergency management drill on Wednesday, February 2, 2011.",Emergency Preparedness,10018.0,40.753612,-73.992417
3,The director of development will provide developmental guidance and support to the senior management team of the agency.,Strengthening Communities,11213.0,40.674103,-73.929644
10,Help with the implementation of JASA's Home Delivered Meals survey,Helping Neighbors in Need,10001.0,40.7484356,-73.9940338
20,"Come ring in Spring with a trip to the Central Park Zoo with the kids of Harlem Dowling 125th! We will meet at the Center at 11:00 AM, for a quick lunch, before heading down to the zoo. We will return to the Center for drop-off at 3 PM. Hope you can join us! 11:00 AM",Strengthening Communities,10027.0,40.8104656,-73.9505422
5,"We are looking for dedicated and enthusiastic volunteer mentors for adults with intellectual disabilities (such as autism, Down syndrome). Our programs and services are designed to nurture independence and confidence.",Helping Neighbors in Need,10001.0,40.746817,-73.993655
1,ACTS Community Development is seeking volunteer/intern to research and write grants.,Strengthening Communities,11224.0,40.576239,-73.988218
25,Gain experience you can't get anywhere else as you help people who are experiencing some form of personal crisis--from a bad day to a broken heart to a major loss or depressive illness.,Helping Neighbors in Need,10003.0,40.7313422,-73.9887282
1,Volunteer needed to translate written materials from English into Chinese.,Helping Neighbors in Need,10001.0,40.746817,-73.993655
18,"Help out at this month's Clothing Donation Day. We will be meeting and greeting clothing donors, providing tax receipts, and sorting donations to select only the best for Dress for Success clients. These events fill up quickly, so register soon! 10:45 a.m. - 3:00 p.m.",Helping Neighbors in Need,10001.0,40.7484356,-73.9940338
9999,Due to popular demand the Friends are pleased to offer community members FREE trees to plant on private property.,Strengthening Communities,10463.0,40.884999,-73.892977
50,"Volunteers are needed for Cool Culture's Catch the Cool family event on Saturday, June 19, 2011 that will take place at the Queens Museum of Art in Flushing Meadows Corona Park. The event will be an opportunity for Cool Culture families to take part in museum tours, storytelling and art making.",Strengthening Communities,11368.0,40.7480832,-73.8606294
400,"Please join the JCC staff, members, and neighbors on the tenth anniversary of the tragedies of September 11. Organized community service activities will take place in and outside of our building in remembrance of the events of 9/11. Choose your project on the morning of the event.",Strengthening Communities,10023.0,40.7769111,-73.9812146
2,"We are New York City’s largest girls-only youth and leadership development program where girls learn to lead with courage, confidence and character to make their communities and the world  a better place.",Strengthening Communities,10453.0,40.8523117,-73.9120143
30,Become at tutor with The Fresh Air Fund and change a child's life forever!,Education,10017.0,40.74991,-73.975061
10,Volunteers help our clients by reviewing and editing résumés/coverletters and giving interview tips to a woman in need. They also meet with clients to perform mock interviews and informational interviews in order to give them a chance to practice and improve their communication skills.,Helping Neighbors in Need,10453.0,40.853537,-73.908741
5,"A team of mature adults staff our desk in front of the surgical suites.  Providing information, connecting families and physicians post surgically and guiding families to the resources they need is the focus of this volunteer experience.",Health,11215.0,40.668293,-73.979237
2,"In 2010, POTS’ Case Managers helped close to 1,100 people including 315 families with 300+ children identify barriers to stability and take steps to address them.  369 individuals were provided information and referrals to link with detox, educational and employment programs, shelter.",Helping Neighbors in Need,10458.0,40.865714,-73.886305
2011,Join our membership campaign to become the largest timebank in the United States!,Helping Neighbors in Need,10007.0,40.7141085,-74.0083369
10,Help immigrants and new Americans practice their English through some Coffee & Conversation!,Helping Neighbors in Need,11215.0,40.668597,-73.976861
1,"Fall internships run from September-December and require 12-16 in-office hours per week with occasional Saturday events. Interns report directly to development staff, assisting with key aspects of funder research, proposal drafting and packaging, outreach, and communications.",Education,10018.0,40.754116,-73.9903452
20,"Far Rockaway Beach, Queens.  Volunteers needed for crafts, games and face painting.  The event takes place on April 30th.",Strengthening Communities,11415.0,40.710954,-73.835147
5,"Recruit, supervise, and communicate with volunteers and interns in our office and all over the world.",Strengthening Communities,10025.0,40.7978043,-73.9675844
100,"The World Science Festival, returning to New York City June 1-5, 2011 with a sweeping array of cutting-edge science programs designed to make the esoteric understandable and the familiar fascinating, is once again looking to assemble the best volunteer team in the business!",Strengthening Communities,10115.0,40.811101,-73.964168
15,"Stop 'N' Swap reduces NYC's waste by finding new homes for unwanted, but usable items.  Help sort, fold and display items to make this a fun free reuse experience for all.",Environment,10455.0,40.8154619,-73.9088498
20,Volunteers help with organizing pantry and pre-packing grocery bags and produce orders.,Helping Neighbors in Need,10029.0,40.7920324,-73.9445047
20,Volunteers needed to teach seniors basic computer skills.,Strengthening Communities,10017.0,40.750245,-73.976909
